{
  "schema_version": 1,
  "generation": "inventory-v1",
  "source_id": "inventory-source-v1",
  "max_future_seconds": 30,
  "targets": [
    {
      "target": "vpn-p0",
      "role": "watchdog",
      "lifecycle": "enabled",
      "ever_seen": true,
      "label_values": {
        "node": ["vpn-p0"],
        "role": ["watchdog"]
      },
      "required_families": ["vpn_watchdog_collection_success"]
    }
  ]
}
